date,title,content
2026-02-28,Trump’s Attack on Iran Is Reckless,"Donald Trump promised voters that he would end wars, not start them."
2026-03-01,Democrats Question Trump’s Urgency to Attack Iran,"Lawmakers questioned whether the United States faced an “imminent” threat from Iran, a requirement for the president to lawfully initiate military action without congressional approval."
2026-03-01,Trump Says He Is the ‘Least Racist’ President. But His Term Echoes a Grim Past.,"Woodrow Wilson’s presidency has taken on new resonance among historians and critics of President Trump, particularly when it comes to race."
2026-03-01,"In Latest Turn From Talks to War, U.S. Casts Doubt on Diplomacy","President Trump again deployed heavy force against a country with which he had been negotiating, continuing a pattern seen in previous attacks on Iran and Venezuela."
2026-03-01,"Stakes Quickly Rise for U.S. in War, With 3 Service Members Killed","The grim toll signaled that Iran was more prepared for war than the Trump administration anticipated, U.S. military officials said."
2026-03-01,Trump and Netanyahu Are Doing the Free World a Favor,"American hearts should be moved by moments like this, when free nations band together to administer justice and supply hope."
2026-03-01,Trump Stays Out of Public View After U.S. Launches Military Assault on Iran,"President Trump did not deliver a formal address to the American public to explain why the country was at war, a departure from his predecessors."
2026-03-01,A Tyrant Falls. Dangerous Uncertainty Begins.,"No one should mourn Ayatollah Khamenei, but Trump is creating the opportunity for chaos and violence with his campaign against Iran."
2026-03-01,Why Diplomacy Was Doomed: Trump’s Issue Was Iran’s Leadership Itself,President Trump’s envoys negotiated with Iran over its nuclear program. But Mr. Trump and Prime Minister Benjamin Netanyahu of Israel wanted much more.
2026-03-01,Iran Got Trump All Wrong,"We should not squander this moment, when Iran is uniquely weak and vulnerable and we hold all of the advantages — literally."
2026-03-01,Trump Says He’s Open to Talks With Iran’s New Leadership,"In an interview with The Atlantic, President Trump said the country’s new leaders after the death of Ayatollah Ali Khamenei “want to talk” but did not say whom he was referring to."
2026-03-02,"U.S. Imposes Sanctions on Rwanda, Saying It Sabotaged Trump Peace Deal",Rwanda’s government responded by claiming the sanctions unjustly targeted only one party to the conflict and misrepresented the facts.
2026-03-02,Trump Signals U.S. Is Prepared for Long War Against Iran,President Trump also declined to rule out sending ground troops into Iran as the conflict spread into the Gulf countries and Lebanon and Israel exchanged strikes.
2026-03-02,Trump Foresees an Extended War,"Also, how the U.S. decided to strike Iran. Here’s the latest at the end of Monday."
2026-03-02,They’re Hiring at U.S.A.I.D. Just Not Anyone Who Worked There.,The Trump administration said in a memo it wanted to “avoid the risk of impaired objectivity” by hiring former staff members to wind down operations at the U.S. Agency for International Development.
2026-03-02,"After the Attack on Iran, Fear and Support",Readers debate the justification for President Trump’s decision to take military action against Iran.
2026-03-02,He Hatched a Plot to Kill Trump on a Napkin. The F.B.I. Was Listening.,"Testimony and evidence in Asif Merchant’s trial has so far portrayed him as a zealous yet bumbling operative who never came close to his mission, which prosecutors say was backed by Iran."
2026-03-02,How Trump Decided to Go to War,President Trump’s embrace of military action in Iran was spurred by an Israeli leader determined to end diplomatic negotiations. Few of the president’s advisers voiced opposition.
2026-03-02,"Attacks on Iran Heighten Fears in Cuba, Already Under U.S. Pressure",Many Cubans are wondering if the Trump administration plans to target their country’s Communist government next.
2026-03-02,Latino Democrats Fight to Fend Off Upstart Challengers,The Congressional Hispanic Caucus is defending four key incumbents in primary races centered on how aggressively Democrats are combating ICE and President Trump.
2026-03-02,The Unexpected Winners From Trump’s New Global Tariff,The president’s flat 10 percent tariff is most beneficial to nations that previously faced the highest rates. But it’s not clear how much that will prompt a new surge in imports.
2026-03-02,Latest Question on Trump’s Health: What Is That Neck Rash?,President Trump’s physician did not explain what the skin condition was or what medication he was using to treat it.
2026-03-02,Top Iranian Security Official Calls Trump’s War Aims ‘Delusional’,"Ali Larijani, seen as a pragmatist who could negotiate with Washington, struck a defiant tone and vowed to fight on."
2026-03-02,The Pentagon’s Favorite Tech Guy Is This Hawaiian Shirt-Wearing Founder,"Palmer Luckey, who founded the defense tech start-up Anduril, has become the It Guy as President Trump aims to modernize the U.S. military with autonomous weapons."
2026-03-02,Trump Says War Could Last Weeks and Offers Contradictory Visions of New Regime,"In a brief interview, he said the country’s hardened military should simply surrender their weapons to the Iranian public."
2026-03-02,"An N.F.L. Kicker, a Yankee and a Sports Reporter Walk Into the Midterms","As podcasts and talk radio blur the lines between sports and politics, professional athletes — many of whom have found encouragement from President Trump — are running in midterm elections."
2026-03-02,Don’t Let Trump Ruin the World Cup,The World Cup is a chance for the U.S. to show it is more than Trump.
2026-03-02,"Democrats Denounce Trump’s Iran Attack, but Subtle Divisions Emerge","While most Democrats have opposed his decision, their responses reveal differences over Middle East policy and national security that loom over the party’s future."
2026-03-02,Trump May Come to Regret This,"The old U.S.-led order is dead. The new one feels unstable and ominous, as if a storm could descend at any moment."
2026-03-02,How to Think About Trump’s War With Iran,"Ending the Islamic republic’s regime will be long and arduous, but perhaps a softer version will emerge."
2026-03-02,"As Trump Bombs Iran, America’s Allies Watch Fitfully From Sidelines","Disregarded by President Trump over Iran, Europe’s leaders are adapting to a world in which they are little more than bystanders."
2026-03-02,"Trump Says More U.S. Casualties Are ‘Likely’ in War With Iran, and Oil Prices Jump After Attack","Plus, what to know about the A.I. videos that kids are watching."
2026-03-02,6 Conservative Voters React to Attacks on Iran Ahead of the Texas Primaries,President Trump said the attacks were necessary for U.S. security and to free the Iranian people from oppression. Do people who support him agree?
2026-03-03,"Iran’s Strategy: Expand the War, Increase the Cost, Outlast Trump",The Islamic Republic is aiming to draw out the conflict and broaden the fighting. That would force President Trump to risk more casualties and more political capital.
2026-03-03,"You Break It, You Own It? Not for Trump When It Comes to Iran.","“We’ll see what happens with the people,” President Trump said as he appeared to be distancing himself from the longer-term consequences of the war in Iran."
2026-03-03,Here Are the Candidates Trump Has Endorsed in Texas,President Trump is backing numerous candidates running for re-election but has stayed quiet on a few key races.
2026-03-03,"Trump Administration, in Reversal, Tries to Continue Fight Against Law Firms","The administration told a court on Monday that it was abandoning its defense of executive orders targeting the firms. But on Tuesday, the Justice Department abruptly changed its position."
2026-03-03,Homeland Security Investigates Remarks of Border Patrol Leader Gregory Bovino,"Mr. Bovino, who was the face of the Trump administration’s immigration crackdowns in American cities, was reported to have made disparaging comments in reference to the U.S. attorney in Minnesota, who is an Orthodox Jew."
2026-03-03,Congestion Pricing Wins in Court After Lengthy Battle With Trump,"A judge ruled to preserve the toll, ending, for now, a dispute that has become emblematic of New York’s resistance to federal intervention in local affairs."
2026-03-03,"Trump, Iran and a Host of Questions","Questions about the future of the attack on Iran, and other reader perspectives. Also: Drug ads as a resource for patients."
2026-03-03,"As Trump Bashes Spain, the German Chancellor Looks On","Friedrich Merz has called for greater European unity, but he did not publicly object to the president rebuking Spain and Britain during an Oval Office meeting."
2026-03-03,‘Cheap’ and ‘Appalling’: Trump’s Ballroom Plans Receive a Flood of Negative Comments,"The National Capital Planning Commission received about 32,000 messages during its public comment period. Suffice it to say: Many people are not happy with the president’s ballroom plans."
2026-03-03,Trump Lays Out His ‘Worst Case’ Scenario in Iran,"Who will lead Iran once the war is over? “Most of the people we had in mind are dead,” says President Trump."
2026-03-03,Trump Says U.S. Navy Might Escort Tankers in Persian Gulf,Shipping companies are not sending oil and gas through the Strait of Hormuz because they fear their ships might be attacked.
2026-03-03,Trump Letter to Congress Justifying Iran Strikes Outlines No Imminent Threat,"The president told lawmakers that the objective of the assault was to “neutralize Iran’s malign activities,” but did not present evidence of immediate plans by Tehran to attack the United States."
2026-03-03,Trump Suggests He’s Uncertain About Iran’s Future,"Also, the midterms begin with high-stakes showdowns in Texas. Here’s the latest at the end of Tuesday."
2026-03-03,The Iran War Is Trump’s War,Has the president’s unerring instinct for vulnerability finally failed him?
2026-03-03,"Iranians Viewed by U.S. as Potential Leaders Died in Strikes, Trump Says","With the future of Iran deeply uncertain, President Trump acknowledged that it could end up with a ruler “as bad” as Ayatollah Ali Khamenei."
2026-03-03,‘Whatever It Takes’ Rattles Global Markets,President Trump has signaled that he is open to the idea of a prolonged military conflict with Iran. Investors are spooked by that scenario.
2026-03-03,Trump Threatens to End Trade With Spain,His anger stems from the country’s denial of the use of its military bases to U.S. forces involved in the attack against Iran. Spain didn’t seem fazed.
2026-03-03,North Carolina Democrats Hope an Ex-Governor Can Beat Trump’s Senate Pick,"The heavy favorites in the Senate primary are former Gov. Roy Cooper, a moderate Democrat, and Michael Whatley, a former chairman of the Republican National Committee."
2026-03-03,Minnesota Sues Federal Government Over Withheld Medicaid Funds,The Trump administration cited widespread fraud in state social service programs. Minnesota officials said they were victims of “political punishment.”
2026-03-03,"Despite Promises, Veterans Affairs Department Cut Thousands of Roles for Doctors and Nurses",The Trump administration has eliminated health care positions left vacant after a wave of resignations and retirements at the V.A. last year.
2026-03-03,No Empire. No Kings.,Donald Trump’s foreign policy vision is imperialism
2026-03-03,The Idea That Trump Was Antiwar Was Always Delusional,Trump’s foreign policy has often been less a repudiation of neoconservatism than a mutation of it.
2026-03-03,Trump Administration Abandons Efforts to Impose Orders on Law Firms,The move amounts to a surrender in a clash that has led many law firms to submit to the president rather than face the threat of his executive orders.
2026-03-03,"In Plunging Into a Mideast Conflict, Trump Gambles His Presidency","The risks for President Trump from the assault on Iran are escalating as casualties mount, oil prices rise and the war expands across the region."
2026-03-03,Trump Embraces U.S. Military Power After Years of Caution,The wars in Afghanistan and Iraq offered a stark lesson in the limits of military force. The Iran attacks suggest an era of postwar wariness is over.
2026-03-03,All the President’s Portraits,"President Trump’s image — in paint and pixels, on posters and sculptures — is ubiquitous inside the White House, and beyond."
2026-03-03,Trump Says He Will End Boycott of White House Correspondents’ Dinner,"The mentalist Oz Pearlman is this year’s speaker. “Hopefully, it will be something very Special,” the president wrote on Truth Social."
2026-03-03,Melania Trump Promotes ‘Peace Through Education’ at U.N. as War With Iran Expands,"The first lady advocated an increased focus on education and empathy, as her husband has waged war in the Middle East and sought to cut education funding at home."
2026-03-03,"In First Appearance Since Taking the Country to War, Trump Is Business as Usual",President Trump gave a “brief update” on the Iran operation. And then he stayed true to form.
2026-03-03,"Under Pressure from Trump, Cuban Leader Calls for ‘Urgent’ Economic Change","President Miguel Díaz-Canel said the private sector needed more autonomy, as the island confronts a U.S. oil blockade that has deepened a humanitarian crisis."
2026-03-03,Trump Will Host German Leader Today After Sidelining Europe in War,"Chancellor Friedrich Merz’s visit to Washington, long planned, is now likely to be dominated by discussions of the attack, which Europeans did not take part in."
2026-03-03,"In a World Order Defined by Trump, the Key to Europe’s Defense Is Germany","In the wake of the U.S. bombing of Iran and its dismissal of European allies, an anxious continent’s best chance at security runs through its largest economy."
2026-03-03,The Great Lie of War,"Ben Rhodes, a contributing Times Opinion writer, discusses why Trump waged war on Iran — and why his predecessors didn’t dare to."
2026-03-03,Trump Bets That ‘Energy Dominance’ Will Make War in Iran Less Costly,"So far, the energy price shocks have been relatively contained. But a prolonged conflict in the Middle East carries enormous economic risks."
2026-03-03,Nine Law Firms Surrendered. Four Law Firms Won.,The four law firms that fought Trump’s executive orders have forced him to retreat.
2026-03-03,‘I See Him as a Pretty Thoroughgoing Illiberal at This Stage’,The vice president’s political transformation from Trump skeptic to MAGA superstar has many roots.
2026-03-03,Seven Takeaways From the Clintons’ Epstein Depositions,Former Secretary of State Hillary Clinton was defiant. Former President Bill Clinton spoke of President Trump’s ties to Epstein. A Republican raised a conspiracy theory.
2026-03-04,Interior Secretary Visits Venezuela as Part of Oil and Mining Expansion,The trip is part of the Trump administration’s push to build production in the South American nation.
2026-03-04,Why Tech Firms Are Working With Trump on Data Centers and Energy Costs,The White House has floated a new plan to try to ease voter concerns over the A.I. boom’s effect on electric bills. But it won’t be easy to put into practice.
2026-03-04,Trump Says Endorsement in Texas G.O.P. Senate Fight Is Imminent,"The president said on Truth Social that he will call for the candidate who does not receive his endorsement to drop out of the race, which is heading to a runoff."
2026-03-04,Colorado Governor Signals He’ll Commute Sentence of Election Denier,"Pressured by President Trump, Gov. Jared Polis said he is considering the release of Tina Peters, the last high-profile 2020 election meddler still imprisoned. His fellow Democrats are outraged."
2026-03-04,Trump Is Playing a Dangerous Game With Iran,Hungary. Cuba. Afghanistan. Iraq. Now Iran?
2026-03-04,Trump’s High-Profile Oil and Gas Lease Sale in Alaska Has No Takers,"No companies bid for the chance to drill in more than 1 million acres of water off Alaska’s Cook Inlet, the Interior Department said Wednesday."
2026-03-04,Trump’s Lopsided Vision for the White House,See how much his East Wing ballroom design will upend the White House symmetry.
2026-03-04,Senate Thwarts Bid to Curb Trump’s War Powers on Iran,Nearly every Republican voted to block a measure that would require that President Trump win authorization from Congress to continue the offensive in the Middle East.
2026-03-04,Trump Announces A.I. Industry Pledge to Pay for Power,"Companies including Google, Microsoft and OpenAI committed to pay for the power plants and grid upgrades needed to run their data centers."
2026-03-04,Four Questions About What’s Next in Texas,The biggest immediate one: What will Trump do?
2026-03-04,The Best Playbook for Investing During a War Is Usually Doing Nothing,"The Trump administration has breached so many norms that the old approach carries heightened risks, our columnist says."
2026-03-04,"Justice Dept., Under Pressure From Trump, Fails to Build Autopen Case Against Biden","Prosecutors in the U.S. attorney’s office in Washington were unable to build a case, underscoring the department’s increasing inability to follow through on the president’s desire to indict his rivals."
2026-03-04,Trump Justice Dept. Seeks to Stall State Bar Discipline of Its Lawyers,"The administration has no control over the disciplinary authorities of state bar associations, but a new proposal would let the attorney general ask them to suspend proceedings involving department lawyers."
2026-03-04,Jimmy Kimmel Wants to Host the White House Correspondents’ Dinner,"“Please, give the people what they want for once,” the talk show host appealed to President Trump. “This is our destiny together, you and me. Think about it.”"
2026-03-04,"Spain’s Leader, Rejecting Iran War, Escalates Long Feud With Trump","Prime Minister Pedro Sánchez has lashed out at the American-Israeli strikes, underlining his refusal to participate even after President Trump threatened Madrid with economic retaliation."
2026-03-04,5 Things to Know About John Cornyn,"A longtime fixture of Republican politics in Texas, he has occasionally criticized President Trump."
2026-03-04,Trump Tries to Quiet Claims Among Supporters That Israel Dragged Him Into War,Many of President Trump’s allies have urged him and his Make America Great Again movement to shift away from their close ties to Israel and military entanglements in the Middle East.
2026-03-04,Hegseth Says U.S. Strike Killed an Iranian Who Plotted to Assassinate Trump,"The Pentagon provided few details, but the Trump administration has said that Iran’s efforts to kill U.S. officials is one reason the United States launched its bombing campaign."
2026-03-04,Tracking Trump’s Endorsements in the March 3rd Primaries,President Trump has endorsed hundreds of Republicans ahead of the midterm primary elections. See who is winning and losing.
2026-03-04,Democrats Question Credentials of Armed Squad Created by Trump Ally,"Bruce Blakeman, the Republican candidate for governor of New York, formed a band of special deputies. A lawsuit calls the unit’s members unqualified and says that some appear to have arrest records."
2026-03-04,Trump Keeps Finding New Ways to Withhold Money Even After 198 Lawsuits,"If the courts force the administration to restore money to one group, it moves on to another."
2026-03-04,Representative Dan Crenshaw Loses G.O.P. Primary in Texas,"The victory by Steve Toth, a hard-line Texas state representative, underscored how even a conservative House member could lose Republican voters by breaking with President Trump."
2026-03-04,"With Fuel Running Out, Cuba’s Tourism Is Collapsing","The Trump administration’s decision to cut off foreign oil to the island is devastating its tourism industry, a key source of income for a government being pushed to the edge."
2026-03-04,"On Iran, Vance Balances Between Trump and the Anti-Intervention Right","JD Vance long championed opposition to conflicts abroad. With President Trump all-in on war with Iran, the vice president is staying loyal even as allies make his qualms known."
2026-03-04,Iran’s Secret Outreach Highlights Trump’s Challenge,"President Trump is beginning to consider what sort of Iranian government might come next, as the U.S.-Israeli assault continues."
2026-03-04,"Trump’s ‘Worst Case’ Scenario in Iran, and the Most Expensive Primary in U.S. History","Plus, the fight over daylight saving time."
2026-03-04,A Primary That Could Upend G.O.P. Power in N.C. Is Still Too Close to Call,"But that did not stop the challenger, Sam Page, a small-town sheriff steeped in President Trump’s political movement, from declaring victory in the State Senate race."
2026-03-05,"Nature Report, Killed by Trump, Is Released Independently",A draft assessment of the health of nature in the United States is grim but shot through with bright spots and possibility.
2026-03-05,States Sue to Stop Trump From Reviving Steep Tariffs,"The lawsuit filed by two dozen attorneys general seeks to invalidate the president’s new, 10 percent global tax on imports."
2026-03-05,Trump Announces He Is Replacing Noem With Oklahoma Senator,"The president said he would replace Kristi Noem, the homeland security secretary, with Senator Markwayne Mullin, after Ms. Noem was grilled by Republicans at a congressional hearing."
2026-03-05,Trump Says He Should Have Role in Choosing Iran’s Next Leader,The president’s comments were the most detailed he has been about his vision of a U.S. role in creating a new government in Tehran.
2026-03-05,Lindsey Halligan Is Under Investigation by the Florida Bar,"The actions of Ms. Halligan, who as a U.S. attorney brought criminal cases against President Trump’s enemies, are under review by the organization that licensed her to practice law."
2026-03-05,Pokémon Company Objects to White House’s Political Memes,"“No permission was granted for the use of our intellectual property,” the company said. The Trump administration frequently promotes policies with content from video games."
2026-03-05,Board Delays Vote on Trump’s Ballroom Amid Deluge of Public Criticism,"The National Capital Planning Commission, led by Trump allies, moved the vote to next month and listened to hours of public testimony, much of it negative, about the plan."
2026-03-05,House Turns Back Bid to Restrict Trump’s War Powers in Iran,"A handful of Democrats joined Republicans to defeat an effort to force President Trump to go to Congress for approval to continue using force against Iran, while two G.O.P. lawmakers backed it."
2026-03-05,"Lev Parnas, Who Turned Against Trump, Announces Run for Congress as Democrat","Mr. Parnas, who once tried to help find damaging information on Hunter Biden, said his background had turned him into “an advocate for speaking truth to power.”"
2026-03-05,"Israel Begins Assault in Southern Beirut, Raising Fears of Wider Incursion","As the war with Iran threatens to engulf more countries in the region, President Trump said he wanted to be involved in picking a new leader in Tehran."
2026-03-05,"Who Is Markwayne Mullin, Trump’s Pick for Homeland Security Secretary?",The Oklahoma senator has been a staunch defender of the Trump administration’s mass deportation campaign.
2026-03-05,How Trump’s Firing of Noem Sets Off a Political Scramble in Oklahoma,The president’s choice of Senator Markwayne Mullin of Oklahoma to replace her at the Department of Homeland Security could trigger a cascade of aspirants for his seat.
2026-03-05,Trump Fires His Homeland Security Secretary,"Also, child care costs are rising fast. Here’s the latest at the end of Thursday."
2026-03-05,"As a Fired Noem Speaks in Nashville, Senators Welcome Her Replacement","The remarkable split-screen underscored how abruptly Kristi Noem’s ouster as homeland security secretary had unfolded, even by the standards of President Trump’s fast-paced Washington."
2026-03-05,A Judge’s ‘Battle Royale’ With Trump and the Supreme Court,"After repeated but cryptic rebukes from the justices, Judge Brian Murphy last week again ruled against one of the administration’s signature immigration programs."
2026-03-05,Trump Follows His Gut. His National Security Advisers Try to Keep Up.,"Decisions come fast, even if contradictions and inconsistencies abound. But without much of a process, there is little preparation for how things can go wrong."
2026-03-05,Did Israel Push Trump Into War?,President Trump’s embrace of military action in Iran was spurred by an Israeli leader determined to end diplomatic negotiations.
2026-03-05,Trump Says He Wants to Destroy Iran’s Navy. Here’s What to Know.,"The United States has long considered Iranian naval ships a serious threat, even as the country’s nuclear and missile programs dominate discussions of its military capabilities."
2026-03-05,U.S. Court Takes First Steps Toward Ordering Tariff Refunds,"The Trump administration is likely to appeal the move, as it ramps up its attempt to slow or potentially block the repayment of billions in past duties."
2026-03-05,Progressive Challenger Concedes in N.C.’s Bluest Congressional District,The Associated Press had not yet called the race. The contest was widely viewed as a bellwether for the type of candidate that Democratic voters wished to elevate in the Trump era.
2026-03-05,Man Accused of Plotting to Kill Trump Blames Iran for Scheme,"Asif Merchant testified in his own defense, saying he participated in the plot to protect his family in Iran. Prosecutors reject his account of his motives."
