date,title,content
2025-12-17,Tankers Under Sanction Are Only a Subset of Fleet Moving Venezuelan Oil,The scope of President Trump’s blockade against ships carrying oil from Venezuela was not clear on Wednesday.
2025-12-17,"ICE Arrests Disrupt Schools, Prompting Fear Among Families","President Trump’s immigration crackdown has at times resulted in arrests near schools, setting off concerns among parents, educators and students."
2025-12-17,Trump Dangles Cash Payments to Buoy Voters’ Views of the Economy,"With tariffs unpopular and prices still high, the White House has teased the promise of tariff rebates and large tax refunds next year."
2025-12-18,Why the Affordability Crisis Is Likely to Stalk Trump,The president promoted his economic accomplishments in a defiant address. But some voters are feeling the pinch of stubborn inflation and a cooling labor market.
2025-12-18,Trump Administration Tries to Stop Some Immigrants From Driving Trucks,"The Transportation Department said the new rules were intended to make roads safer, but there’s no data to suggest that immigrants cause more truck accidents."
2025-12-18,Truth Social Parent to Merge With Nuclear Fusion Firm in $6 Billion Deal,"Trump Media & Technology Group, the social media and crypto company part owned by President Trump, said it would help develop a “utility-scale fusion power plant.”"
2025-12-18,Trump’s ‘Warrior Dividend’ for Troops Will Be Paid for by Pentagon Housing Funds,"President Trump promised active duty troops a $1,776 check, citing increased revenue raised by tariffs, but the funding is coming from money for the military included in this year’s domestic spending law."
2025-12-18,"Trump Moves to End Gender-Related Care for Minors, Threatening Hospitals That Offer It",Proposed new rules would punish the hospitals by pulling all federal financing. Advocates say lawsuits will follow.
2025-12-18,"Trump’s Drone Strikes Are Wrong. Obama’s Were, Too",Readers respond to a guest essay on why the recent boat strikes by the Trump administration are unjustified.
2025-12-18,U.S. Accuses Venezuelan of Masterminding Tren de Aragua’s Expansion,"The gang, which was the subject of charges brought in several states, is President Trump’s chosen nemesis. The defendant remains at large."
2025-12-18,Trump Signs Order to Ease Restrictions on Marijuana,Marijuana’s classification as one of the most dangerous and habit-forming substances has long drawn criticism.
2025-12-18,"As Trump Puts His Brand on Washington, the Kennedy Center Gets a New Name","The board for the John F. Kennedy Center for the Performing Arts announced that it would now be named the Trump-Kennedy Center, although a formal change may have to be approved by Congress."
2025-12-18,The Junior Congressman Who’s Pushing Republicans on Epstein,"The top Democrat on the Oversight Committee, Representative Robert Garcia has brought aggressive tactics and reality-show flair to investigating Jeffrey Epstein’s ties to President Trump."
2025-12-18,How Will Trump’s Policies Affect You? We Answer Your Questions.,Hard to follow the dizzying array of developments out of Washington over the past year? Here are our answers to your pressing questions.
2025-12-18,Coming Soon to a TV Near Trump: A G.O.P. Ad in N.Y. Governor’s Race,"Bruce Blakeman, an ally of President Trump, is buying ad time on Fox News in the West Palm Beach, Fla., market, where Mr. Trump may be watching."
2025-12-18,Trump Relies on Distortions to Support His Pressure Campaign on Venezuela,The president has a long record of making false or misleading statements. But the sheer density of them in his administration’s boat attacks and Venezuela pressure campaign is exceptional.
2025-12-18,"N.Y.C. Subway Crime Is Down, Hochul Says, Rebutting Trump Officials","Gov. Kathy Hochul said the state would spend another $77 million on police patrols in the subway, acknowledging that felony assaults remain stubbornly high."
2025-12-18,"Trump’s Combative Prime Time Speech, and the Growing Right-to-Die Movement","Plus, don’t blame the dogs in strollers."
2025-12-18,Is It About the Oil?,We look at what President Trump is trying to achieve in Venezuela.
2025-12-18,The Judges Being Pizza Doxxed in My Dead Son’s Name,"The rise in judicial threats is being fueled by the political rhetoric of the Trump administration, a judge argues."
2025-12-18,The Trump Economy and America’s Bad Mood,"Trump is giving himself an A-plus-plus-plus, but the rest of America is anxious."
2025-12-18,Here’s What to Expect From Trump’s Speech,President Trump will address the nation on Wednesday night at 9 p.m. Eastern time. The New York Times will provide live coverage and analysis.
2025-12-18,Trump’s handling of the economy has dragged down his approval rating.,
2025-12-18,"Presidential History, According to Trump","The White House unveiled plaques near the Oval Office that describe U.S. presidents with varying levels of accuracy, depending on President Trump’s opinion of them."
2025-12-18,‘Who’s Gonna Stop You?’ Listen to Trump Press Georgia Speaker Over 2020 Vote.,"During much of the 12.5-minute call, President Trump reiterated his claims that he had won Georgia, a state he lost by more than 11,000 votes that year."
2025-12-18,"In Combative Speech, Trump Tries to Deflect Blame for Economic Concerns","Mixing misleading claims with repeated attacks, President Trump promised relief for Americans but said he needed time to deliver it."
2025-12-18,"Love, or at Least Marriage, Is in the Air in Trump’s Washington","Several prominent conservative figures have announced that they are engaged this week, news often celebrated by President Trump."
2025-12-18,Fact-Checking Trump’s Prime-Time Address on the Economy,"The president cited misleading statistics to insist, wrongly, that prices were coming down."
2025-12-18,U.S. Military Announces 4 Killed in 26th Boat Strike,The attack on Wednesday brings the total number killed to at least 99 since the Trump administration began bombing boats suspected of ferrying drugs in the Caribbean Sea and the Pacific Ocean.
2025-12-18,A Bellicose Trump Points Fingers in Defending His Record on the Economy,"In an 18-minute address, President Trump said the economy was booming despite the public’s consistent concerns about prices. Here are six takeaways from the speech."
2025-12-18,Trump Officials Announce More Than $11 Billion in Arms Sales for Taiwan,The move may reassure China hawks who are uncertain about the president’s commitment to the self-governing democracy.
2025-12-18,Late Night Shades Trump’s Impromptu ‘Liar-Side Chat’,Jimmy Kimmel called the president’s last-minute speech “a surprise prime-time episode of ‘The Worst Wing’ tonight on every channel.”
2025-12-18,‘Don’s Best Friend’: How Epstein and Trump Bonded Over the Pursuit of Women,"The president has tried to minimize their friendship, but documents and interviews reveal an intense and complicated relationship. Chasing women was a game of ego and dominance. Female bodies were currency."
2025-12-18,Full Transcript of President Trump’s Speech on the Economy,The president sharply attacked his predecessor while insisting that his own record contained nothing but victories.
2025-12-19,Weighing Politics and Morality in the Israel Debate,Readers respond to an essay criticizing U.S. Democrats’ failure to resolve the conflict in Gaza. Also: Trump’s Kennedy Center rebrand; blaming immigrants after the Brown shooting.
2025-12-19,Trump Announces Pricing Deals With Nine Drugmakers,The companies were the latest to agree to sell drugs to Medicaid and directly to consumers at discounted prices. President Trump said he would soon begin similar negotiations with health insurers.
2025-12-19,University of Virginia’s Board Names a New President,The selection of Scott Beardsley by the G.O.P.-appointed board comes after the previous president resigned under pressure from the Trump administration. A new Democratic-appointed board could try to overturn the choice.
2025-12-19,Elise Stefanik Drops Out of N.Y. Governor’s Race and Will Leave Congress,"Ms. Stefanik, a Republican congresswoman and staunch ally of President Trump, abruptly ended her bid to unseat Gov. Kathy Hochul and said she would not seek another House term."
2025-12-19,Trump’s Name Joins Kennedy’s on Performing Arts Center’s Facade,Workers hauled up large letters spelling out Mr. Trump’s full name to add to the white marble face of the building on Friday morning.
2025-12-19,Trump Picks New Leader for Southern Command as Venezuela Pressure Grows,"Lt. Gen. Francis L. Donovan, a Marine general with expansive experience in special operations and the Middle East, would take over after the abrupt departure of the previous commander."
2025-12-19,"A Memorial to Kennedy? It’s Trump’s Now, Too.","The Kennedy Center installed President Trump’s name on the facade of the arts center, which had been designated as a living memorial to President John F. Kennedy."
2025-12-19,Bill Clinton Features Prominently in Epstein Files Release,The focus on a former president comes at a moment when Republicans have fought to shift public attention away from Mr. Epstein’s friendship with President Trump.
2025-12-19,Trump’s Name Is Rarely Mentioned in New Epstein Files,The files that The Times initially reviewed on Friday included only a handful of references to or images of Mr. Trump.
2025-12-19,Justice Dept. Will Appeal Dismissal of Comey and James Indictments,"The Trump administration had vowed to fight a judge’s decision to dismiss unrelated criminal charges against James Comey, the former F.B.I. director, and Letitia James, the attorney general of New York."
2025-12-19,Venezuela Was Once a Close U.S. Ally. What Went Wrong?,"Closely tied to Washington during much of the Cold War, Venezuela has gone through political upheavals over the years that now make it a major enemy in the eyes of the Trump administration."
2025-12-19,U.S. Strikes Islamic State Targets in Syria,"American forces struck dozens of suspected ISIS sites, making good on President Trump’s vow to avenge two American soldiers and a civilian U.S. interpreter killed by the group last week."
2025-12-19,A Somber Mood at Science Meeting as Trump Budget Cuts Continue,"News of the breakup of a leading science institution rippled through an annual gathering of Earth, ocean and space scientists. Many say American science is suffering under the Trump administration."
2025-12-19,"For Trump, Epstein is the story that won’t go away.",
2025-12-19,"Another Trump Financial Conflict, This Time With Nuclear Power","Trump Media plans to merge with a company developing nuclear fusion technology, putting the president’s financial interests in competition with other energy companies over which his administration holds sway."
2025-12-19,"Shouting, Ranting, Insulting: Trump’s Uninhibited Second Term",Many of President Trump’s supporters love his professional-wrestling style of leadership. But some of his recent attacks have sickened even some of his own political allies.
2025-12-19,Democratic State Lawmakers Vow to Unite and Push Back on Trump’s Deportations,Lawmakers from a half-dozen states said Thursday they will use legislation next year to thwart the tactics of federal law enforcement carrying out immigration policies.
2025-12-19,Trump Administration to Appeal Harvard Funding Case,"Facing a deadline to appeal, the Justice Department told the courts late Thursday that it would try to overturn a judge’s ruling in favor of Harvard."
2025-12-19,Jimmy Kimmel Wishes Trump Wouldn’t Yell at Us on Live TV,"As the president addressed the nation about the economy, it was “hard to tell if he was giving a speech or having a seizure on TV,” Kimmel said."
2025-12-19,U.S. Attacks Another Boat Believed to Be Trafficking Drugs,"The attack killed 5 people, the latest known fatalities since the attacks began in September. The Trump administration has accused those on the boats of ferrying narcotics but provided little proof."
2025-12-19,Trump-Appointed Judge Flays ICE Over Conditions in Long Island Lockup,"A detainee and eight others were held in a tiny room with an open toilet in freezing, filthy conditions."
2025-12-19,"Brown University Shooting Suspect Found Dead, and Trump Eases Marijuana Restrictions","Plus, your Friday news quiz."
2025-12-19,Trump Says the Economy Is Good. Is It?,"President Trump defended the economy in an 18-minute address, despite the public’s consistent concerns about prices."
2025-12-19,Trump Administration Pauses Diversity Immigration Program After Brown Shooting,Homeland Security Secretary Kristi Noem said President Trump had ordered the program to be suspended after it emerged that the shooting suspect had used it to obtain a green card.
2025-12-19,Trump Signs Law Repealing Tough Sanctions on Syria,The Caesar Act was imposed in 2019 in response to widespread and systematic violations of human rights by the regime of former dictator Bashar al-Assad.
2025-12-19,What Trump’s Push Into Nuclear Means for the Sector (and His Net Worth),The president’s paper wealth soared on news that the company behind Truth Social has agreed to merge with a fusion start-up. But China is way ahead in the funding race to commercialize the technology.
2025-12-19,Trump’s New Marijuana Policy Offers an Opportunity,"All policy decisions have trade-offs, and cannabis legalization is no exception."
2025-12-20,Trump Administration Pushes Asylum Seekers to Apply in Other Countries,"In immigration courts, U.S. lawyers have filed thousands of requests to dismiss asylum cases and force people to pursue asylum elsewhere."
2025-12-20,"Epstein Files Photos Disappear From Government Website, Including One of Trump","A total of 16 photos were taken down at some point on Saturday from the website that the Justice Department created. One featured an open drawer containing other photos, including at least one of President Trump."
2025-12-20,Donald Trump Is Very Unhappy With You,It’s all over but the shouting.
2025-12-20,"From A.I. to Tariffs, 14 Charts That Explain 2025","President Trump’s trade policy, inflation and climbing stock prices shaped business and the economy this year."
2025-12-20,How Democrats Used One Word to Turn the Tide Against Trump,Both parties are now preparing for “affordability” to play a major role in the midterm elections next year. How did it emerge so quickly?
2025-12-20,Elise Stefanik Tried Everything to Please Trump. He Still Jilted Her.,The G.O.P. congresswoman who ran as a moderate but became an “ultra MAGA” Trump acolyte ultimately found herself undermined by the president and politically adrift.
2025-12-20,A Timeline of How the Trump Administration Released and Withheld Epstein Files,A year of political pressure and partial disclosures preceded the release of long-sought records on Jeffrey Epstein.
2025-12-20,What to Know on the Initial Release of Materials From the Epstein Files,The Justice Department came under scrutiny for its handling of the documents and deletions online of some material. It said it would not remove mentions of Donald Trump from the files as they are released.
2025-12-20,Judge Blocks Trump Administration’s Homeless Aid Plan,The proposal would have required recipients to get treatment for addiction or mental illness as a condition of receiving housing funds. The administration has said it will try again.
2025-12-20,"Rubio Meets (and Meets, and Meets … ) the Press","The secretary of state held a marathon news conference, offering little news but more respect for reporters than most others in the Trump administration."
2025-12-20,"U.S. and Venezuela Jam Caribbean GPS Signals to Thwart Attacks, Raising Flight Hazard",Military brinkmanship between President Trump and Nicolás Maduro of Venezuela has led to an increase in electronic warfare in the region.
2025-12-21,The Trump Vibe Shift Is Dead,What will come in its wake?
2025-12-21,Bowen Yang Sings His Swan Song on ‘S.N.L.’,"Hosted by Ariana Grande and featuring Cher as its musical guest, the show had plenty of holiday tunes and a satirical greeting from President Trump."
2025-12-21,Trump Takes America’s ‘Imperial Presidency’ to a New Level,"In his first year back in the White House, President Trump has greatly expanded executive power while embracing the trappings of royalty in ways not seen in the modern era."
2025-12-21,Blanche Says Mentions of Trump in Epstein Files Won’t Be Removed,"In an interview with NBC, the No. 2 official at the Justice Department denied that officials were protecting the president from what has been disclosed."
2025-12-21,Long-Haul Trucking Was a Refuge for Sikh Immigrants. Until Now.,"Two high-profile crashes and a Trump administration crackdown have brought worry, and wariness, to the community."
2025-12-21,"329 Days of Trump, Trump, Trump",President Trump dominates our collective consciousness. The Times broke down how he has relentlessly pursued attention in the first 329 days of his second term.
2025-12-21,Immigration Crackdown Creates Fault Lines Among Baptists,An increasingly loud contingent supports the Trump administration’s efforts to deport illegal immigrants.
2025-12-22,Trump Administration Declares Foreign-Made Drones a Security Threat,"Americans won’t be able to buy new models from DJI, the Chinese maker of most of the world’s drones. But U.S. pilots can keep the drones they have."
2025-12-22,Trump Administration Loosens Protections for Iconic Greater Sage Grouse,"The government moves to make it easier to drill, mine and graze on 50 million acres of land in the West."
2025-12-22,Trump Halts Offshore Wind Farms,"Plus, Assad’s luxurious life in Moscow. Here’s the latest at the end of Monday."
2025-12-22,Inside the Deportation Machine,"An analysis of data on every ICE arrest, detention stay and deportation reveals the complexity and reach of President Trump’s immigration crackdown."
2025-12-22,Ex-C.I.A. Chief Asks to Keep Justice Dept. From Steering Case to Favored Judge,"The request, addressed to the top federal judge in Miami, sought to block a U.S. attorney from pursuing a politically charged inquiry before Judge Aileen Cannon, who has repeatedly decided in President Trump’s favor."
2025-12-22,How U.S. Defense Industry Dodged a Rare-Earth Shortage After China’s Curbs,"America’s ability to make precision-guided missiles was threatened during Trump’s tariff war. But experienced players have rescued the supply chain, for now."
2025-12-22,How Trump’s First Year Reshaped U.S. Energy and Climate Policy,The sweeping changes have affected everything from coal plant retirements to international diplomacy over shipping emissions.
2025-12-22,"In Congress and at Home, Omar Faces Trump’s Anti-Somali Attacks","Representative Ilhan Omar, Democrat of Minnesota, has long been a target of racist insults by the president. Now her whole community faces an immigration crackdown."
2025-12-22,"Who Is Jeff Landry, Trump’s Special Envoy to Greenland?","Mr. Landry, the governor of Louisiana, is a fierce supporter of the president. But his experience in international relations isn’t extensive."
2025-12-22,"Angering Denmark, Trump Appoints Special Envoy to Greenland","President Trump, who has long said he wants to “get” the semiautonomous Danish territory, tapped Louisiana’s governor for the new position. Officials in Greenland and Denmark expressed outrage."
2025-12-22,Hundreds of Big Post-Election Donors Have Benefited From Trump’s Return to Office,"Well into his second term, the president and his allies have continued aggressively raising money. Many donors have interests before his administration, The Times found."
2025-12-22,A Conspicuous Gap May Undermine Trump’s Birthright Citizenship Plan,A historical review shows lawmakers without certain familial records went unchallenged as citizens when the 14th Amendment was adopted. The finding appeared to undercut the president’s claims on birthright citizenship.
2025-12-22,The Most Important Thing We Learned From Susie Wiles,There are no wallflowers in Trump’s White House.
2025-12-22,Are Trump’s Actions Unprecedented? We Asked Historians (Again).,"An examination of whether his recent moves have no precedent, are relatively common or somewhere in between."
2025-12-22,Their Death Sentences Were Commuted by Biden. They Could Face Execution Again.,At least four of the 37 men whose sentences were commuted last year could face the death penalty at the state level after a push from the Trump administration.
2025-12-22,The Planned Parenthood Closed. A Christian Clinic Seized the Moment.,"About 50 Planned Parenthoods have shut down this year, largely a result of efforts by President Trump and Republicans to target the organization."
2025-12-22,"As Trump Clings to Tariffs, His Argentine Ally Is Opening Up to Trade","President Javier Milei is eliminating barriers to what had been a closed-off economy, moving in the opposite direction of his main political ally, President Trump."
2025-12-22,Trump Halts 5 Wind Farms Off the East Coast,"The Interior Department said the projects posed national security risks, without providing details. The decision imperils billions of dollars of investments."
2025-12-23,Federal Prosecutor Was Surprised by Trump’s Flights on Epstein’s Jet,A 2020 email noted that Donald Trump was listed as a passenger on Jeffrey Epstein’s jet at least eight times from 1993 to 1996.
2025-12-23,Trump Administration Delays Tariffs on Chinese Semiconductors,An investigation ruled that China’s inroads into the chip industry had hurt the United States. The administration delayed tariffs until 2027 amid a fragile truce between the countries.
2025-12-23,"In Epstein Files, Administration Officials Point to Clinton, and Away From Trump","The Justice Department initially removed, then restored, a photograph that included an image of President Trump, and issued a statement calling mentions of him “untrue and sensationalist claims.”"
2025-12-23,Democratic Governors Are Fighting Trump’s War on Wind Energy,"Leaders in Connecticut, Massachusetts, New York and Rhode Island are racing to save offshore wind farms targeted by the president."
2025-12-23,Stephen Miller Cites Children of Immigrants as a Problem,"As it seeks to end birthright citizenship, the Trump administration is arguing that immigrants bring problems that extend for generations. The data shows otherwise."
2025-12-23,Looking Back at a Historic Year of Dismantling Climate Policies,"The Trump administration has aggressively pulled America away from its global role in climate and environmental research, diplomacy, regulation and investment."
2025-12-23,Pro-Trump Influencers Stay Conspicuously Quiet About Epstein Files,Their silence contrasted with the uproar made over the weekend when the Justice Department’s first release focused on former President Bill Clinton.
2025-12-23,‘60 Minutes’ Report Was Pulled Off the Air. Now It’s on the Internet.,"At the last minute, CBS News held a segment about Venezuelan men who were deported by the Trump administration to a prison in El Salvador. It surfaced online anyway."
2025-12-23,Supreme Court Refuses to Allow Trump to Deploy National Guard in Chicago,"President Trump ordered state-based troops to Portland, Ore.; Los Angeles; Washington; and Chicago over the objections of state and local officials."
2025-12-23,Trump’s Tanker Crackdown Paralyzes Venezuelan Oil Exports,"Oil exports, the country’s financial lifeblood, have plummeted after the United States took action against three ships that have been used to carry its crude."
2025-12-23,Here’s what to know about the latest release of documents from the Epstein files.,"The new documents — nearly 30,000 in all — contain hundreds of references to President Trump and include different versions of Jeffrey Epstein’s will."
2025-12-23,‘He’s a Maximalist’: Inside Trump’s Gilded Oval Office,"Take a 3-D tour of the president’s office, where he covered a third of the wall space with gold."
2025-12-23,Why Doesn’t Trump Like Wind Farms?,We examine the Trump administration’s approach to the wind industry.
2025-12-23,Israel Needs to Get Out of Trump’s Way,"President Trump should press Prime Minister Benjamin Netanyahu to ease military pressure on Gaza, Lebanon and Syria for the sake of his own policy."
2025-12-23,Trump May Give 775 Acres of a Federal Wildlife Refuge to SpaceX,"In exchange for the land in Texas, the rocket and satellite company would give the government some of its own property nearby, documents show."
2025-12-23,"Trump’s Greenland Strategy, and the New Promise of Weight-Loss Pills","Plus, the biggest lottery jackpots ever."
2025-12-23,Trump Administration Will Investigate Brown’s Security After Shooting,"The Department of Education is looking at whether security at Brown University, including its surveillance system, was up to standard. Brown said it would conduct its own investigation."
2025-12-23,Trump Officials Sue to Loosen D.C.’s Gun Laws,The Justice Department challenged laws aimed at popular rifles including the AR-15 in the nation’s capital.
2025-12-23,Lawmaker Sues to Remove Trump’s Name From the Kennedy Center,"Representative Joyce Beatty, Democrat of Ohio, argues that only Congress is authorized to rename the D.C. performing arts institution."
2025-12-23,Trump Announces New ‘Trump Class’ of Warships,"The president said development of the vessels would help maintain military superiority and improve the industrial base, but analysts suggested they were the wrong approach to current threats."
