date,title,content
2026-01-23,ICE Demands More Access to Minnesota Inmates. But It’s Complicated.,The Trump administration said it would ease its immigration operation in Minnesota in exchange for broader access to inmates. Local leaders say they already cooperate significantly.
2026-01-23,"Trump Says U.S. ‘Armada’ Is Heading to Iran, Raising Pressure on Regime","President Trump said the United States was “watching Iran” and sending a naval force there, despite also saying that his threats had halted executions."
2026-01-23,National Park Service Dismantles Slavery Exhibit in Philadelphia,The exhibit memorialized nine people enslaved by George Washington. The Park Service said it was being removed in accordance with a directive from President Trump.
2026-01-23,Trump Rescinds Canada’s Invitation to Join His ‘Board of Peace’,"The president appeared to be lashing out in response to stark, high-profile remarks by Prime Minister Mark Carney of Canada that rejected Mr. Trump’s efforts to dismantle the international order."
2026-01-23,Who Owns TikTok in the U.S. Now?,Several big companies and investment firms are part of the new American TikTok. Many have ties to one another and President Trump.
2026-01-23,"Voters Are Split on Deportations but Disapprove of ICE, Poll Finds","While roughly half of voters support President Trump’s handling of the border between the United States and Mexico, a sizable majority says that ICE’s tactics have “gone too far.”"
2026-01-23,Minneapolis Reveals Where Trump’s Deportation Agenda Is Going,"Caitlin Dickerson, an immigration reporter, explains the different pieces of Trump’s deportation machine."
2026-01-23,Trump’s Investigator Breaks His Silence,"Jack Smith, the former special prosecutor, argued a case he was never allowed to in court: that President Trump “engaged in criminal activity” that undermined democracy."
2026-01-23,Trump Says He Bruised His Hand on a Table,The president also said he was prone to bruising because of the high dose of aspirin he has taken daily for three decades.
2026-01-23,Starmer Joins Other British Politicians in Anger Over Trump’s Afghanistan War Claim,"President Trump said that NATO soldiers stayed “a little off the front lines” during the conflict. In Britain, which lost 457 soldiers in the war, the response was swift."
2026-01-23,Seth Meyers Says Trump’s Deals Are as Strong as a Pinkie Swear,"“At this point, it’s pretty clear world leaders make deals with Trump the way kids do on the playground,” Meyers said of the president on Wednesday."
2026-01-24,Mark Carney Takes On Donald Trump and Emerges as a Global Political Star,"At the World Economic Forum in Davos, Switzerland, the prime minister was praised for his blunt talk about the president’s irrevocable “rupture” in the world order."
2026-01-24,Trump and Federal Officials Try to Blame Minnesota Authorities and Slain Man,"Before an investigation could be conducted, they called Alex Jeffrey Pretti a “domestic terrorist” and said the governor and Minneapolis mayor were inciting rebellion."
2026-01-24,See How Trump Refashioned the ‘People’s House’,"In a year, the president has altered 10 spaces in the White House."
2026-01-24,How Trump Is Rewriting America With 230 Executive Orders,The flurry of actions have pointed the country in a new direction.
2026-01-24,The World Will Remember Trump’s Greenland Outburst,It is time for Americans to step up and defend NATO and our country’s vital interests in its survival.
2026-01-24,The Emotions President Trump Evokes,We asked voters to describe their emotions about President Trump’s second term so far. Most spoke of happiness or hostility.
2026-01-24,Trump Threatens Canada With Tariffs as Post-Davos Fallout Continues,"President Trump said he would impose tariffs if Canada made “a deal with China,” though there is no sign that those countries are discussing a broad trade agreement."
2026-01-24,How a Year of Trump Changed Britain,Prime Minister Keir Starmer stood firm over Greenland. But his center-left government and the country as a whole have been buffeted by President Trump.
2026-01-24,"As Trump Focuses Abroad, G.O.P. Toils to Hone Election Message",A new poll shows that voters who will decide control of Congress see a lack of presidential emphasis on critical domestic issues.
2026-01-24,How a Water Balloon Fight in Venezuela Ended in Charges of Treason,Venezuela’s interim government has been praised by President Trump. It has also maintained its state security apparatus to stamp out any perceived dissent.
2026-01-24,"Despite Trump’s Words, China and Russia Are Not Threatening Greenland","U.S. and European officials say they are unaware of any intelligence that shows China and Russia are endangering the island, which is protected by the NATO security umbrella."
2026-01-24,Videos Showing Aggressive ICE Tactics in Minnesota Fuel a Backlash,"For weeks, residents have documented the impact of President Trump’s mass deportation campaign and captured many violent confrontations on camera."
2026-01-24,Federal Judge Extends Deportation Protections for Burmese Migrants,The ruling represents another setback in the Trump administration’s mass deportation campaign.
2026-01-25,Most Fox News Reporting on Minneapolis Shooting Supports Official Version,"Fox anchors were laser focused on promoting the Trump administration’s narrative that the slain protester, Alex Pretti, had brought the violence upon himself."
2026-01-25,Deputy attorney general takes a measured tone after Trump officials call the shooting victim a terrorist.,Other senior officials in the Trump administration continued to cast blame on the man shot by federal agents.
2026-01-25,"For Trump, the Truth in Minneapolis Is What He Says It Is","The Trump team has advanced one-sided narratives to justify each of the killings, even when bystander video shows something else entirely."
2026-01-25,The Trump Administration Is Lying to Our Faces. Congress Must Act.,The Trump administration is once again engaged in a perversion of justice.
2026-01-25,‘S.N.L.’: The Big Winner of the First Trump Awards? Guess Who.,"A covetous president grabbed up all the trophies on this week’s “Saturday Night Live” broadcast, hosted by Teyana Taylor, star of “One Battle After Another.”"
2026-01-25,John Kerry: Trump Struck a Greenland Deal. But the Damage Is Done.,"The former U.S. secretary of state warns that, between the Greenland deal and Trump’s trashing of the world order, America is losing."
2026-01-25,"Republicans Struggle to Respond to Shooting, Reflecting Political Peril","The killing of a 37-year-old man by a federal agent exposed fresh cracks in G.O.P. unity, with some expressing alarm while others stayed silent or backed the Trump administration."
2026-01-25,Trump’s Neediness Is Transforming America,The president’s neediness is transforming our institutions.
2026-01-25,"Trump Pushes A.I. Data Centers, but the G.O.P. Is Cool to One in Alabama","Residents also oppose a data center the size of 18 Walmarts that is set to be built in pristine woodland outside Bessemer, Ala. “All this will be gone,” one said."
2026-01-25,Trump Just Proved Carney’s Point,Canada’s prime minister sees the president all too well.
2026-01-25,It’s So Hard Not to Be Consumed by Rage,"I worry that for some of us, our antipathy to Trump has become part of who we are, and it can be something of a personal poison."
2026-01-25,"Quote of the Day: Trump Pushes A.I. Data Centers, but One in Alabama Gets Cool Response","Quotation of the Day for Sunday, January 25, 2026."
2026-01-25,The Woman Who Stands Between Donald Trump and Greenland,"Mette Frederiksen, Denmark’s leader, has taken big risks standing up to Mr. Trump. It might just be working — for now."
2026-01-25,Trump Is Right About the Arctic. He’s Wrong About Greenland.,"The area most U.S. Arctic strategists think needs the most immediate development is not Greenland but the Bering Sea, almost 3,000 miles away."
2026-01-26,Why Is the Trump Administration Demanding Minnesota’s Voter Rolls?,The Justice Department has urged Minnesota to hand over voters’ private data. It is part of a national push that has raised concerns about the Trump administration’s motives.
2026-01-26,Crackdown Chief to Leave Minneapolis as White House Distances Trump From Uproar,"The departure of Gregory Bovino, whose tactics have drawn sharp criticism, is an indication that officials see Alex Pretti’s killing as a political threat to President Trump."
2026-01-26,"On Foreign Policy, Trump’s Fans Give Him the Benefit of the Doubt","At least so far, President Trump has managed to bring along even those conservative supporters who are skeptical of foreign interventions."
2026-01-26,"As Tech Chiefs Woo Trump, Silicon Valley Seethes Over Minneapolis Shootings","Executives, investors and engineers are speaking out against the Trump administration after the killings of Alex Pretti and Renee Good in moves reminiscent of Silicon Valley a decade ago."
2026-01-26,NATO Chief Says Europe Is ‘Dreaming’ if It Thinks It Can Defend Itself Without U.S.,"Mark Rutte, the secretary general of the alliance, told members of the European Parliament that President Trump was “doing a lot of good stuff.”"
2026-01-26,Trump Says He Will Raise Tariffs on South Korea to 25%,"President Trump threatened to increase tariffs on South Korean exports, including cars, citing the country’s slow ratification of a trade deal."
2026-01-26,Trump Changes Course in Minnesota,"Also, large parts of the U.S. are dangerously cold. Here’s the latest at the end of Monday."
2026-01-26,"Shootings Pose a Hard Question for the Right: Who’s a Conservative, Really?","Republicans wrestle with Trump administration positions that seem to contradict their beliefs on gun rights, states’ rights and limited use of federal power."
2026-01-26,Trump Briefed on Intelligence Saying Iran’s Government Is Weaker,"Protests that erupted late last year shook elements of the Iranian government, according to the reports."
2026-01-26,"Trump Is Sending Tom Homan, His Border Czar, to Minnesota","“He has not been involved in that area, but knows and likes many of the people there,” President Trump wrote on Truth Social on Monday."
2026-01-26,Border Patrol Official Gregory Bovino Is Set to Leave Minnesota,"The news of Mr. Bovino’s impending departure came hours after President Trump sent his border czar, Tom Homan, to take control of ICE operations in the state."
2026-01-26,"Trump Administration Tries to Control Minneapolis Shooting Narrative, and Winter Storm Shatters Records","Plus, High January is the new Dry January."
2026-01-26,Minnesota Claims the ICE Surge Is Illegal. A Judge Will Hear Arguments on Monday.,"State and local officials say the federal deployment of immigration agents violates the 10th Amendment. The surge, which the Trump administration has defended, has led to three shootings and tense protests."
2026-01-26,A Crisis of Confidence for ICE and Border Patrol as Clashes Escalate,"Current and former officials describe growing frustration and disillusionment with the Trump administration’s approach, even as they support the goal of immigration enforcement."
2026-01-26,Film Club: ‘We Came Here Legally. ICE Locked Us Up Anyway.’,What do the stories from inside the ICE detention system tell us about the Trump administration’s immigration crackdowns — and America?
2026-01-26,False Posts and Altered Images Distort Views of Minnesota Shooting,"Some social media posts tried to warp the evidence of the killing of a nurse in Minneapolis, including in ways intended to support the Trump administration’s narrative about it."
2026-01-26,How the Trump Administration Rushed to Judgment in Minneapolis Shooting,"The administration was in a race to control the narrative around the killing of Alex Pretti, even as videos emerged that contradicted the government’s account."
2026-01-26,Trump Blames Democrats for ‘Tragic’ Deaths as Agents Clash With Protesters,"Top administration officials had earlier, and without evidence, accused each of the shooting victims in Minneapolis of “domestic terrorism.”"
2026-01-26,The Taliban Say They’re Ready to Release U.S. Prisoners. But Which Ones?,"Top Afghan officials say they want two American detainees released “as soon as possible,” but the Trump administration says a third one should be included."
2026-01-26,Killing Prompts Only a Defiant Response From Trump,"Even as the second death of a protester in Minnesota brought demands for accountability, the president, insulated from dissenting voices, stuck to his pattern of reflexively blaming opponents."
2026-01-26,This Theory Explains Trump’s Baffling Foreign Policy,The president’s approach is not just chaos or an updated version of 19th-century great-power competition.
2026-01-26,Trump Hobbled the I.R.S. This C.E.O. Now Has to Make It Work.,"Frank Bisignano is the first chief executive of the I.R.S., where there’s hope he will end a chaotic stretch at the agency. The tax filing season, which started Monday, is his first test."
2026-01-26,The Trump Administration Now Thinks Clean Air Is Worthless,Average Americans could experience significant hits to their health and their pocketbooks.
2026-01-26,"As Europe’s Reliance on U.S. Natural Gas Grows, So Does Trump’s Leverage",Tension over Greenland has prompted worries that the Trump administration could turn the U.S. oil and gas industry into a way to pressure Europe.
2026-01-27,U.S. Population Growth Slows Sharply as Immigration Numbers Plunge,"New census estimates show the effects of falling birthrates and President Trump’s anti-immigration policies. As his term continues, immigration is expected to drop even further."
2026-01-27,Trinidadian Families File Wrongful Death Lawsuit Over Boat Strike by U.S. Military,The case tests the Trump administration’s argument that its extrajudicial killings of people suspected of smuggling drugs at sea have been lawful.
2026-01-27,"She’s the Face of Trump’s Aviation Safety Board, and She’s a Democrat","Jennifer Homendy, the outspoken chairwoman of the National Transportation Safety Board, is reclaiming the spotlight at a meeting on Tuesday about the Washington, D.C., crash that killed 67."
2026-01-27,‘Latinas for Trump’ Co-Founder Warns Immigration Will Cost G.O.P. the Midterms,"State Senator Ileana Garcia, who is Cuban American, said the fatal shooting of Alex Pretti by Border Patrol agents in Minneapolis was “abhorrent.”"
2026-01-27,Denmark’s Leader Isn’t Sure How Long America Will Be an Ally,"President Trump’s efforts to pry Greenland from Denmark show that “the old world order is now gone,” Prime Minister Mette Frederiksen warned in Berlin."
2026-01-27,Employment Commission Chair Recasts Workplace Discrimination in Trump’s Image,"Andrea Lucas, the chair of the Equal Employment Opportunity Commission, has said she wants to undo years of what she describes as activist excess around labor law."
2026-01-27,Judge Revives Wind Farm That Trump Halted Off Martha’s Vineyard,"The project, known as Vineyard Wind, was already 95 percent complete when the Trump administration ordered construction to stop."
2026-01-27,Board of Peace Set to Hand Trump Sweeping Powers Over Gaza,"A draft resolution revealed some of the plans for the new international body, which met for the first time last week amid criticism from some U.S. allies."
2026-01-27,"On Immigration, the G.O.P. Finds Itself in a Shocking Place: On Defense","Since President Trump’s rise, the issue has been a strength for the party. But now, after the chaos in Minnesota, Democrats see an opening and some Republicans worry that Mr. Trump is going too far."
2026-01-27,Shaheen and Murkowski: Congress Must Defend NATO From Trump,America must defend its greatest asset: Its alliances.
2026-01-27,Texas Moves to Curtail Visas for Skilled Foreign Workers,"Gov. Greg Abbott said the state would investigate public agencies and universities that employ those with H-1B visas, a program the Trump administration has also targeted."
2026-01-27,"After a Second Killing in Minneapolis, How Are You Feeling About Where America Is Heading?","Federal agents fatally shot a second U.S. citizen on Saturday during protests of President Trump’s immigration crackdown, prompting many Americans to reflect on the state of the country. Teenagers, what do you think?"
2026-01-27,Homeland Security’s Shifting Mission Over the Past Quarter-Century,"Established after the Sept. 11 attacks to protect the country against terrorism, the agency absorbed immigration functions that have become its focus under President Trump."
2026-01-27,Mark Carney Rejects Suggestions That He Walked Back His Davos Speech to Trump,Scott Bessent said that the Canadian prime minister had recanted his call on middle powers to no longer accommodate the U.S.
2026-01-27,"Alexander Vindman, of Trump Impeachment Fame, Runs for Senate in Florida","Mr. Vindman will run for the Democratic nomination to take on Senator Ashley Moody, a Republican. The race is an uphill fight for Democrats, but Mr. Vindman could be a strong fund-raiser."
2026-01-27,"Trump Changes Course in Minneapolis, and Social Media Giants Face Big Tobacco-Style Lawsuits","Plus, Mamdani’s snowstorm recommendation."
2026-01-27,Trump Administration Takes Another Stake in Rare Earth Sector,"The administration announced a $1.6 billion deal with USA Rare Earth. The firm also does business with Cantor Fitzgerald, which is run by the sons of President Trump’s commerce secretary."
2026-01-27,Trump Holds 2-Hour Meeting With Noem Amid Backlash to Minneapolis Shooting,"The meeting is a sign that the president is concerned about the fallout from the killing of Alex Pretti, who was shot by immigration agents."
2026-01-27,Britain Seeks Trade With China Without Triggering Trump’s Fury,Prime Minister Keir Starmer hopes to boost his country’s lagging economy with a trip to Beijing. But he must carefully navigate between two superpowers.
2026-01-27,"In Trump’s Shadow, India and the European Union Expand Trade Ties","After nearly 20 years of negotiations, the two sides struck a far-reaching agreement that officials called “the mother of all trade deals.”"
2026-01-27,"Vowing Higher Tariffs, Trump Rattles South Korea Months After Trade Deal","President Trump said Seoul was not moving fast enough to implement the agreement, which calls for South Korea to invest billions in the United States."
2026-01-27,‘The Biggest Act of Union-Busting in U.S. History’: Trump’s War on Federal Workers,"With 300,000 employees gone and collective-bargaining rights eliminated, the administration has hobbled organized labor. Did it also start a movement?"
2026-01-27,How Trump Became a Liability for Europe’s Far Right,"Europe’s nationalist leaders once saw President Trump as an ideological ally. Now, as he threatens European sovereignty, they are seeking distance — at least for the moment."
2026-01-27,Work Will Stop on Critical Tunnel Project Unless Trump Restores Funding,"The builders of the Gateway project, a critical rail tunnel between New York and New Jersey, warned that construction cannot continue without the withheld federal money."
2026-01-27,This Is Rewriting the International Order as Much as Trump,"Why the competition for, and control of, energy resources is central to global politics."
2026-01-27,Greenland’s Biggest Band Is Thrust Into an Uneasy Spotlight,"With President Trump threatening to seize the territory, curious listeners have discovered its poppy rock group Nanook."
2026-01-27,"Fed, Signaling Little Urgency, Prepares to Pause on Rate Cuts","The Federal Reserve is expected to hold interest rates steady on Wednesday, despite relentless attacks from President Trump over borrowing costs."
2026-01-27,"As Trump Promotes Economy in Iowa, Many Residents Feel Pain",Farmers are critical to Iowa’s economy. They have been battered by President Trump’s tariffs and are not experiencing the “golden age” that the president promised.
2026-01-27,Trump’s Fantasies Are Killing Us,But being a “hot” country does not make you a good country. Or a decent one.
2026-01-27,G.O.P. Congressman: We Need to Wake Up After Minneapolis,A Republican member of Congress argues that neither Biden nor Trump had the right solution on immigration.
2026-01-27,"After Donations, Trump Administration Revoked Rule Requiring More Nursing Home Staff","Executives who donated to the president’s super PAC met privately with him and urged a repeal of the rule, which was intended to prevent neglect of patients."
2026-01-28,Trump Changes Course in Minneapolis,"The White House has been met with broad outcry over the killing of Alex Pretti, as well as pushback from Congress."
2026-01-28,Nervous Allies and Fox News: How Trump Realized He Had a Big Problem in Minneapolis,"President Trump often blusters his way through a crisis, refusing to back down. Minneapolis tested the limits of that strategy."
2026-01-28,Trump threatens Iran again and calls for negotiations on a nuclear deal.,
2026-01-28,"What to Know About Ilhan Omar, the Lawmaker Attacked in Minnesota","Ms. Omar, a Democratic member of Congress, has come under fire for years, most notably from President Trump."
2026-01-28,Iraq’s Nominee for Prime Minister Rejects Trump Threats,"Nuri Kamal al-Maliki, a former prime minister, was nominated to lead Iraq once again, but President Trump said he would cut U.S. support if that went ahead."
2026-01-28,Trump Threatens Iran With ‘Massive Armada’ and Presses a Set of Demands,"U.S. and European officials say they have put three demands in front of the Iranians, including a permanent end to all enrichment of uranium."
2026-01-28,Melania Trump Documentary Pulled From South African Theaters,"The distributor, which was set to release the film on Friday, said it had canceled the theatrical premiere because of “recent developments,” but declined to specify."
2026-01-28,White House Use of ‘Domestic Terrorist’ Doesn’t Match Legal Reality,"The Trump administration has used the term as a cudgel against political adversaries, especially this month to defend immigration officers who had killed two protesters in Minneapolis."
2026-01-28,"Springsteen Releases ‘Streets of Minneapolis,’ a Song Protesting ICE","The lyrics criticize President Trump and include references to Alex Pretti and Renee Good, who were fatally shot by federal agents this month."
2026-01-28,Attack on Ilhan Omar Follows Years of Trump’s Targeting Her,"President Trump has spent years demonizing and dehumanizing the Somali-born Democrat from Minnesota, fueling escalating threats against her."
2026-01-28,‘No Win’ for Minneapolis Police Caught Between Trump and City Residents,"With the Trump administration accusing local police of dereliction and some in the community feeling unprotected, outnumbered Minneapolis officers find themselves facing difficult choices."
2026-01-28,Trump’s Political Drama With Powell Overshadows Fed Rate Decision,"The Trump administration has unleashed a barrage of attacks on the Federal Reserve, including a criminal investigation into its chair, Jerome H. Powell."
2026-01-28,Move to Seize Ballots Thrusts F.B.I. Into Trump’s Election Conspiracy Claim,"F.B.I. agents searched a Fulton County, Ga., election center for ballots from 2020, escalating an investigation of a heavily Democratic jurisdiction the president has criticized over his defeat."
2026-01-28,Fed Holds Rates Steady as It Points to an Improving Economy,"The Federal Reserve chose to pause rate cuts, even as it faces relentless attacks from President Trump for not cutting borrowing costs fast enough."
2026-01-28,"Noem’s Handling of Shooting Put Her in Trump’s Penalty Box, but Just Briefly",Kristi Noem’s aggressiveness has sometimes given President Trump heartburn. She got a rebuke after a second killing by federal immigration agents but soon seemed to be back in his good graces.
2026-01-28,"On China, Trump Is Rolling the Dice on America’s Future","Keeping Beijing off balance has advantages, but Trump may just be playing for short-term political gain."
2026-01-28,"Trump Issues Order, but No Funds, to Push Faster Rebuilding After L.A. Fires","Over the weekend, the president demanded that local officials expedite rebuilding permits and ordered an audit of federal funds. But he was silent on the region’s stalled request for $34 billion in federal aid."
2026-01-28,"Republicans Shift Tone After Killings, Criticizing Trump’s Immigration Push","With the president signaling a pivot in his crackdown, G.O.P. lawmakers have felt freer to express concern. But it’s not clear what they are willing to do about it."
2026-01-28,"Trump Suggests He Will ‘De-Escalate’ in Minneapolis, Without Offering Details","President Trump continued to put the blame on Alex Pretti for legally carrying a weapon with a permit, saying, “You can’t walk in with guns.”"
2026-01-28,Minneapolis May Be Trump’s Gettysburg,The White House has failed to achieve either its strategic or its tactical goals in Minnesota.
2026-01-28,Why Did the Trump Administration Silence Bovino on Social Media?,"When the border chief got yanked from Minnesota, he lost access to his X account, too."
2026-01-28,Trump Threatens to Pull U.S. Help From Iraq if Former Leader Returns,"Nuri Kamal al-Maliki, a former prime minister, has been nominated to the post by the main Shiite Muslim bloc in the Iraqi Parliament."
2026-01-28,Minnesota Leaders Meet With White House Border Czar,"Gov. Tim Walz and the mayor of Minneapolis, Jacob Frey, met separately with the Trump aide Tom Homan on Tuesday. All three described the discussions as a productive starting point."
